{
  "id": "level-01",
  "slug": "level-01",
  "name": "Level 1",
  "version": 1,
  "schema_version": "1.0",
  "status": "PUBLISHED",
  "sequence": 1,
  "seed": 11001,
  "player": { "x": 640, "y": 610 },
  "enemy_formations": [{ "type": "scout", "rows": 2, "columns": 29, "origin": { "x": 50, "y": 120 }, "spacing": { "x": 40, "y": 50 } }],
  "shields": [{ "count": 8, "matrix": [[1,1,1,1,1,1,1,1],[1,1,1,1,1,1,1,1],[1,1,1,1,1,1,1,1],[1,1,0,0,0,0,1,1],[1,1,0,0,0,0,1,1]] }],
  "performance_budget": { "max_enemies": 58 }
}
